2017-04-01 16:30:28.780840 IP 74.125.206.125.5222 > 192.168.1.60.51583: Flags [.], ack 938385167, win 442, options [nop,nop,TS val 710693834 ecr 402959000], length 0
2017-04-01 16:30:28.780950 IP 192.168.1.60.51583 > 74.125.206.125.5222: Flags [P.], seq 1:2, ack 0, win 4096, options [nop,nop,TS val 402959021 ecr 710693834], length 1
2017-04-01 16:30:28.803960 IP 74.125.206.125.5222 > 192.168.1.60.51583: Flags [.], ack 2, win 442, options [nop,nop,TS val 710693857 ecr 402959021], length 0
2017-04-01 16:30:28.804090 IP 192.168.1.60.51583 > 74.125.206.125.5222: Flags [P.], seq 2:3, ack 0, win 4096, options [nop,nop,TS val 402959044 ecr 710693857], length 1

